{
  "id": "rep-1",
  "executive_summary": "Key findings this week.",
  "insights": [
    {
      "id": "ins-1",
      "domain": "product",
      "title": "Monday usage spike",
      "summary": "Users return after weekend; +12% weekly_active.",
      "confidence": 0.7,
      "impact": "Plan onboarding nudges on Monday mornings.",
      "metrics": [{ "name": "weekly_active", "value": 1200, "unit": "users" }],
      "figures": [{ "caption": "WAU trend", "path": "figs/wau.png" }],
      "methodology": "Timeseries analysis",
      "evidence": "Notebook cell #12"
    }
  ],
  "hypotheses": [
    {
      "id": "hyp-1",
      "title": "Personalized tips increase adoption",
      "problem": "Low sustained engagement",
      "domain": "product",
      "stakeholders": ["Product","Marketing"],
      "beneficiaries": ["End users"],
      "data_available": ["Events","Sessions"],
      "metrics": [{ "name": "adoption_rate", "baseline": 0.35, "target": 0.45, "method": "proportion" }],
      "complexity": { "dev_weeks": 3, "ml_weeks": 1, "infra_weeks": 1 },
      "risks": ["Cold start"],
      "constraints": ["Privacy"],
      "priority": 0.7,
      "summary": "Run an experiment with tips"
    }
  ],
  "appendix": "",
  "validator_scorecard": {}
}
